Mapping,reads_number,ratio
Reads Mapped to Genome,184482810,93.92806659545118
Reads Mapped Confidently to Genome,163021698,83.00129917929769
Reads Mapped Confidently to Exonic Regions,101741905,51.801143035430066
Reads Mapped Confidently to Intronic Regions,49698253,25.303500187695438
Reads Mapped Confidently to Intergenic Regions,11581540,5.896655956172186
Reads Mapped Confidently to Transcriptome,102533815,52.204338190673006
Reads Mapped Antisense to Gene,5256157,2.6761336990267384
total_reads,196408610,100.0
